title,agency,career_level,salary_range_from,salary_range_to
Contract and Administration Unit Lead,DEPT OF ENVIRONMENT PROTECTION,Experienced (non-manager),65232,151810
Agency Attorney Interne,CIVIL SERVICE COMMISSION,Entry-Level,62397,75760
Desktop Support Technician for the Division of HPD Tech,HOUSING PRESERVATION & DVLPMNT,Experienced (non-manager),54100,79000
Supervising Inspector of The Fire Alarm Inspection Unit,FIRE DEPARTMENT,Experienced (non-manager),53702,80400
Senior Design Reviewer (Mechanical),DEPT OF DESIGN & CONSTRUCTION,Experienced (non-manager),53702,105000
Assistant Director- Shop Healthy- Bureau of Health Equity Capacity Building,DEPT OF HEALTH/MENTAL HYGIENE,Experienced (non-manager),82506,86830
Executive Communications Manager- Bureau of Communications,DEPT OF HEALTH/MENTAL HYGIENE,Experienced (non-manager),72038,160000
Project Manager,DEPT OF DESIGN & CONSTRUCTION,Experienced (non-manager),57078,65640
DIRECTOR OF CAPITAL PLANNING,DEPARTMENT OF CITY PLANNING,Experienced (non-manager),120000,130000
Stationary Engineer,DEPT OF CITYWIDE ADMIN SVCS,Experienced (non-manager),508.8,508.8
Counselor- Employee Assistance Unit,DEPARTMENT OF SANITATION,Experienced (non-manager),54878,98537
Bridge Inspector,DEPARTMENT OF TRANSPORTATION,Experienced (non-manager),80557,111917
Application Developer,DEPT OF ENVIRONMENT PROTECTION,Experienced (non-manager),92194,119610
DIRECTOR OF OPERATIONS,HRA/DEPT OF SOCIAL SERVICES,Experienced (non-manager),94715,136260
Senior Police Administrative Aide,POLICE DEPARTMENT,Experienced (non-manager),43929,57093
RAP TEAM LEADER,HRA/DEPT OF SOCIAL SERVICES,Experienced (non-manager),66430,76394
Administrative Support for the Emergency Operations Division - EOD,HOUSING PRESERVATION & DVLPMNT,Experienced (non-manager),57394,66003
Program Coordinator,DEPT OF ENVIRONMENT PROTECTION,Entry-Level,54100,83981
Community Associate (General Services - Driver),BOROUGH PRESIDENT-BRONX,Entry-Level,38333,63794
Surveyor,DEPT OF DESIGN & CONSTRUCTION,Experienced (non-manager),62415,77087
College Aide,DEPT OF YOUTH & COMM DEV SRVS,Student,15.5,19.9
EHS Regional Manager,DEPT OF ENVIRONMENT PROTECTION,Experienced (non-manager),56972,157803
Executive Assistant,DEPT OF ENVIRONMENT PROTECTION,Experienced (non-manager),53797,73243
Chief Dietitian,DEPARTMENT OF CORRECTION,Experienced (non-manager),59210,63452
Summer Rising Program Manager,DEPT OF YOUTH & COMM DEV SRVS,Experienced (non-manager),32.3569,50.2288
SECTION SUPERVISOR,HRA/DEPT OF SOCIAL SERVICES,Experienced (non-manager),53057,61015
OATH/ECB Hearing Representative,DEPARTMENT OF BUILDINGS,Experienced (non-manager),62397,71757
Senior Project Manager- Building Optimization,DEPT OF CITYWIDE ADMIN SVCS,Manager,85000,95000
Fleet Inspector,DEPT OF CITYWIDE ADMIN SVCS,Experienced (non-manager),298.24,347.2
Stationary Engineer,DEPT OF HEALTH/MENTAL HYGIENE,Experienced (non-manager),508.8,508.8
Associate Youth Development Specialist,ADMIN FOR CHILDREN'S SVCS,Experienced (non-manager),63717,72670
Revenue Analyst- Bureau of Revenue,DEPT OF HEALTH/MENTAL HYGIENE,Experienced (non-manager),53797,65000
Plumber,DEPT OF PARKS & RECREATION,Experienced (non-manager),56.86,56.86
Plumber,DEPT OF PARKS & RECREATION,Experienced (non-manager),56.86,56.86
Senior Policy Advisor,DEPT OF ENVIRONMENT PROTECTION,Experienced (non-manager),94283,122290
Public Health Adviser Follow-up- Bureau of School Health,DEPT OF HEALTH/MENTAL HYGIENE,Experienced (non-manager),23.39,27.62
Public Health Adviser- Bureau of Public Health Clinics,DEPT OF HEALTH/MENTAL HYGIENE,Experienced (non-manager),41477,50000
Supervisor (Watershed Maintenance) I,DEPT OF ENVIRONMENT PROTECTION,Manager,69006,86450
City Park Worker,DEPT OF PARKS & RECREATION,Entry-Level,16.6264,16.6264
City Park Worker,DEPT OF PARKS & RECREATION,Entry-Level,16.6264,16.6264
Project Manager,HOUSING PRESERVATION & DVLPMNT,Entry-Level,70000,77500
Project Manager,DEPARTMENT OF TRANSPORTATION,Entry-Level,51413,62260
Assistant Commissioner- Procurement/ACCO,DEPARTMENT OF CORRECTION,Manager,150000,165000
CARETAKER E - ELEVATOR DISPATCHER,NYC HOUSING AUTHORITY,Entry-Level,31836,46278
Agency Attorney Interne- Workers' Rights,OFFICE OF THE COMPTROLLER,Experienced (non-manager),65000,75000
CONTRACT NEGOTIATIONS & REVIEW SPECIALIST,DEPT OF ENVIRONMENT PROTECTION,Experienced (non-manager),74710,100812
Assistant Plan Examiner,DEPARTMENT OF BUILDINGS,Experienced (non-manager),65193,74972
Test Automation Engineer,FINANCIAL INFO SVCS AGENCY,Experienced (non-manager),108000,115000
TECH SUPPORT JOB ADMIN SUPERVISOR,FINANCIAL INFO SVCS AGENCY,Experienced (non-manager),75000,88500
Job Order Contract Project Manager,DEPT OF ENVIRONMENT PROTECTION,Experienced (non-manager),67757,98128
Executive Director of Budget Management and Planning,DEPARTMENT OF SANITATION,Manager,80931,208826
Digital Forensic Examiner,BRONX DISTRICT ATTORNEY,Experienced (non-manager),75197,75197
Material Logistics Assistant (College Aide),DEPT OF HEALTH/MENTAL HYGIENE,Student,15.5,19.9
PROGRAM LIAISON,HRA/DEPT OF SOCIAL SERVICES,Experienced (non-manager),38605,44396
Data Specialist,DEPARTMENT OF CORRECTION,Experienced (non-manager),60132,69152
Senior Contract Analyst,OFFICE OF THE COMPTROLLER,Experienced (non-manager),65000,75000
Analyst  Technology Budget & Management,OFFICE OF MANAGEMENT & BUDGET,Entry-Level,51550,73806
Deputy Director  Executive,OFFICE OF MANAGEMENT & BUDGET,Executive,222924,231974
FINANCIAL ANALYST,DEPARTMENT OF CITY PLANNING,Experienced (non-manager),62470,71840
Assistant Process Engineer,DEPT OF ENVIRONMENT PROTECTION,Manager,57078,85646
Engineer-in-Charge,DEPARTMENT OF TRANSPORTATION,Experienced (non-manager),90114,122168
BUSINESS INTELLIGENCE SPECIALIST,HRA/DEPT OF SOCIAL SERVICES,Experienced (non-manager),81951,94244
Contract Coordinator,DEPARTMENT OF TRANSPORTATION,Experienced (non-manager),65232,151810
SUPERVISING ATTORNEY,HRA/DEPT OF SOCIAL SERVICES,Experienced (non-manager),83158,95632
UNIT CLERK,HRA/DEPT OF SOCIAL SERVICES,Experienced (non-manager),36390,41848
Analyst  OTI,OFFICE OF MANAGEMENT & BUDGET,Entry-Level,51550,73806
PROPOSAL RATER,DEPT. OF HOMELESS SERVICES,Experienced (non-manager),57078,87359
CASE MANAGEMENT SUPERVISOR,HRA/DEPT OF SOCIAL SERVICES,Experienced (non-manager),51869,59649
Homicide Assistant District Attorney,BRONX DISTRICT ATTORNEY,Experienced (non-manager),120000,167610
Project Manager of Community Engagement and Workforce Training- Bureau of Public Health Clinics,DEPT OF HEALTH/MENTAL HYGIENE,Experienced (non-manager),75504,86830
Data Analyst and Training Coordinator - Provider Quality Assurance (PQA)- Bureau of Immunization,DEPT OF HEALTH/MENTAL HYGIENE,Experienced (non-manager),75504,90303
Senior Construction Manager,DEPT OF ENVIRONMENT PROTECTION,Experienced (non-manager),98470,133496
Senior Research Analyst- Bureau of Hepatitis- HIV- and STI,DEPT OF HEALTH/MENTAL HYGIENE,Experienced (non-manager),92301,97138
Senior Detective Investigator,DISTRICT ATTORNEY RICHMOND COU,Experienced (non-manager),70877,82730
Certified IT Administrator (Database)- III,POLICE DEPARTMENT,Experienced (non-manager),92194,130372
AGENCY ATTORNEY INTERNE,HRA/DEPT OF SOCIAL SERVICES,Experienced (non-manager),62397,75760
Loan Officer- Economically Targeted Investments,OFFICE OF THE COMPTROLLER,Manager,80000,95000
CRM Developer,TAXI & LIMOUSINE COMMISSION,Experienced (non-manager),100000,180000
Supervisor (Watershed Maintenance) II,DEPT OF ENVIRONMENT PROTECTION,Entry-Level,73006,86335
ASSISTANT EXECUTIVE DIRECTOR- OPERATIONS,CAMPAIGN FINANCE BOARD,Executive,160000,175000
CLAIM SPECIALIST LEVEL 1 - AFFIRMATIVE LITIGATION,LAW DEPARTMENT,Experienced (non-manager),41483,47705
CLAIM SPECIALIST LEVEL 1 - AFFIRMATIVE LITIGATION,LAW DEPARTMENT,Experienced (non-manager),41483,47705
Community Specialist for Capacity Building- Bureau of Brooklyn Neighborhood Health,DEPT OF HEALTH/MENTAL HYGIENE,Experienced (non-manager),54100,62215
PEU OUTREACH SPECIALIST,HRA/DEPT OF SOCIAL SERVICES,Experienced (non-manager),40687,56707
TECHNOLOGY TRANSACTIONS ATTORNEY,FINANCIAL INFO SVCS AGENCY,Executive,58700,130000
ASSISTANT HOUSING MANAGER,NYC HOUSING AUTHORITY,Entry-Level,49609,77454
Plan Examiner,FIRE DEPARTMENT,Experienced (non-manager),57078,85646
FIA REGIONAL/ADMINISTRATIVE OFFICE LIAISON,HRA/DEPT OF SOCIAL SERVICES,Experienced (non-manager),67000,77050
Supervisor of Stockworker,TAXI & LIMOUSINE COMMISSION,Experienced (non-manager),21.7729,30
Investment Officer- Private Equity,OFFICE OF THE COMPTROLLER,Manager,110000,133900
Environmental & Safety Coordinator,DEPARTMENT OF TRANSPORTATION,Experienced (non-manager),74041,107227
Workforce Engagement Coordinator- Bureau of Public Health Clinics,DEPT OF HEALTH/MENTAL HYGIENE,Entry-Level,70087,70087
Program Manager- Advance & Earn,DEPT OF YOUTH & COMM DEV SRVS,Experienced (non-manager),54100,83981
Director of Security and Facilities,NYC EMPLOYEES RETIREMENT SYS,Executive,106729,152000
Home Visitor BMIRH Newborn Home Visiting- Bureau of Maternal Infant and Reproductive Health,DEPT OF HEALTH/MENTAL HYGIENE,Experienced (non-manager),47155,60088
Infectious Disease Epidemiologist- Bureau of Communicable Diseases,DEPT OF HEALTH/MENTAL HYGIENE,Experienced (non-manager),75504,86830
DIRECTOR- MAP MEDICAID ELIGIBILITY OPERATIONS,HRA/DEPT OF SOCIAL SERVICES,Experienced (non-manager),66322,98830
Associate Commissioner Of Strategic Communications,FIRE DEPARTMENT,Executive,88936,213000
Goods & Services Procurement Section Unit Lead,DEPT OF ENVIRONMENT PROTECTION,Experienced (non-manager),65232,151810
Summer Rising Program Manager,DEPT OF YOUTH & COMM DEV SRVS,Experienced (non-manager),32.3569,50.2288
DIRECTOR OF HOUSING COURT APPLICATION PROCESSING TEAM,HRA/DEPT OF SOCIAL SERVICES,Experienced (non-manager),73029,85000
Gardener,DEPT OF PARKS & RECREATION,Entry-Level,20.7902,23.91
Gardener,DEPT OF PARKS & RECREATION,Entry-Level,20.7902,23.91
Capital Pest Control Advisor,NYC HOUSING AUTHORITY,Entry-Level,71753,94883
ADMINISTRATIVE ACCOUNTANT (NON MGRL),NYC EMPLOYEES RETIREMENT SYS,Experienced (non-manager),58700,63301
Paralegal Assistant Supervisor- Special Federal Litigation,LAW DEPARTMENT,Experienced (non-manager),43197,60449
Budget Analyst,DEPT OF HEALTH/MENTAL HYGIENE,Experienced (non-manager),62470,80008
Director of Employee Services – Bureau Administrator,DEPT OF ENVIRONMENT PROTECTION,Manager,80931,208826
Senior EHS Specialist- Program Development,DEPT OF ENVIRONMENT PROTECTION,Experienced (non-manager),84468,111003
Paralegal - Labor and Employment Law,LAW DEPARTMENT,Experienced (non-manager),43197,49677
Paralegal - Labor and Employment Law,LAW DEPARTMENT,Experienced (non-manager),43197,49677
DIRECTOR FOR THE DIVISION OF LIENS AND RECOVERY (L&R),HRA/DEPT OF SOCIAL SERVICES,Experienced (non-manager),94715,94715
FLOOR SUPERVISOR,HRA/DEPT OF SOCIAL SERVICES,Experienced (non-manager),58695,67499
Applications Developer (Support),NYC EMPLOYEES RETIREMENT SYS,Experienced (non-manager),92194,130372
Police Administrative Aide,POLICE DEPARTMENT,Experienced (non-manager),39763,60350
Senior Research Analyst- Bureau of Hepatitis- HIV- and STI,DEPT OF HEALTH/MENTAL HYGIENE,Experienced (non-manager),92301,97138
Stationary Engineer,DEPT OF CITYWIDE ADMIN SVCS,Experienced (non-manager),508.8,508.8
STUDENT LEGAL SPECIALIST,LAW DEPARTMENT,Experienced (non-manager),39057,44915
PLASTERER,NYC HOUSING AUTHORITY,Experienced (non-manager),44.82,44.82
Molecular Biologist,DEPT OF ENVIRONMENT PROTECTION,Experienced (non-manager),63962,89003
Project Director,DEPT OF DESIGN & CONSTRUCTION,Experienced (non-manager),74650,103631
Crime Analyst - Crime Strategies Bureau,BRONX DISTRICT ATTORNEY,Experienced (non-manager),54786,54786
Senior Policy Researcher,OFFICE OF THE COMPTROLLER,Manager,90000,100000
Stormwater Inspector,DEPT OF ENVIRONMENT PROTECTION,Entry-Level,49003,72195
CLAIM SPECIALIST - TORT,LAW DEPARTMENT,Experienced (non-manager),41483,47705
CLAIM SPECIALIST - TORT,LAW DEPARTMENT,Experienced (non-manager),41483,47705
Assistant General Counsel,DEPARTMENT OF TRANSPORTATION,Experienced (non-manager),79620,117541
Associate Project Manager II,DEPT OF ENVIRONMENT PROTECTION,Experienced (non-manager),74650,109409
Sheriff Counsel,DEPARTMENT OF FINANCE,Experienced (non-manager),91563,98888
STOCK WORKER II,HRA/DEPT OF SOCIAL SERVICES,Experienced (non-manager),36900,55173
Administrative Budget Supervisor,DEPARTMENT FOR THE AGING,Manager,85000,105000
Digital Evidence Specialist,BRONX DISTRICT ATTORNEY,Experienced (non-manager),60000,60000
Clerical Support for the Emergency Operations Division,HOUSING PRESERVATION & DVLPMNT,Entry-Level,38333,44083
City Seasonal Aide,DEPT OF PARKS & RECREATION,Entry-Level,15.45,15.45
City Park Worker,DEPT OF ENVIRONMENT PROTECTION,Entry-Level,34716,39923
EXECUTIVE ASSISTANT TO AC OF EMS ADMIN,FIRE DEPARTMENT,Experienced (non-manager),60718,90773
Engineer-In-Charge,DEPT OF DESIGN & CONSTRUCTION,Experienced (non-manager),80557,92640
Junior Engineer Design,DEPT OF DESIGN & CONSTRUCTION,Entry-Level,51413,59125
Early Childhood Education Consultant- Bureau of Childcare,DEPT OF HEALTH/MENTAL HYGIENE,Experienced (non-manager),66442,72000
Painter,DEPARTMENT OF TRANSPORTATION,Experienced (non-manager),315.07,315.07
Problem Resolution Specialist- Bureau of the Public Health Laboratory,DEPT OF HEALTH/MENTAL HYGIENE,Entry-Level,54100,62215
DAT Writer: Early Case Assessment Bureau,BRONX DISTRICT ATTORNEY,Experienced (non-manager),50000,50000
Senior Technical Advisor- Sustainability,DEPARTMENT OF BUILDINGS,Manager,64922,120000
Infectious Disease Epidemiologist- Bureau of Communicable Diseases,DEPT OF HEALTH/MENTAL HYGIENE,Experienced (non-manager),75504,86830
Analyst  Capital Eligibility Review,OFFICE OF MANAGEMENT & BUDGET,Entry-Level,51550,73806
DIRECTOR- REVENUE OF OPTIMIZATION AND AUTOMATION,HRA/DEPT OF SOCIAL SERVICES,Manager,94715,101345
Program Manager- Creating Health Schools and Communities - Bureau of Brooklyn Neighborhood Health,DEPT OF HEALTH/MENTAL HYGIENE,Experienced (non-manager),54100,80000
Procurement Analyst 2,DEPARTMENT OF TRANSPORTATION,Experienced (non-manager),50972,82730
Strategic Planning Coordinator,DEPT OF DESIGN & CONSTRUCTION,Experienced (non-manager),59116,91768
COLLEGE AIDE,FINANCIAL INFO SVCS AGENCY,Student,15.5,16
Executive Office Intern,TECHNOLOGY & INNOVATION,Student,15.5,19.9
Developer (Web Applications),DEPT OF DESIGN & CONSTRUCTION,Experienced (non-manager),100000,113736
CLAIMS EXAMINER,FIRE DEPARTMENT,Experienced (non-manager),41389,47597
Public Health Inspector- Bureau of Food Safety and Community Sanitation (BFSCS),DEPT OF HEALTH/MENTAL HYGIENE,Experienced (non-manager),45722,45722
Public Health Inspector- Bureau of Food Safety and Community Sanitation (BFSCS),DEPT OF HEALTH/MENTAL HYGIENE,Experienced (non-manager),45722,45722
Junior Graphic Designer,DEPT OF PARKS & RECREATION,Experienced (non-manager),59116,91768
Data Manager,DEPT OF ENVIRONMENT PROTECTION,Experienced (non-manager),84468,111003
Civil Engineering Intern,DEPARTMENT OF TRANSPORTATION,Entry-Level,51413,62260
Executive Director of Investment Operations Support,OFFICE OF THE COMPTROLLER,Manager,160000,175000
Job Order Contract Project Manager,DEPT OF ENVIRONMENT PROTECTION,Experienced (non-manager),67757,98128
Director of Access to Care- Bureau of Mental Health- Mental Health,DEPT OF HEALTH/MENTAL HYGIENE,Experienced (non-manager),94715,118000
Investigator – Racial Profiling and Biased Policing,CIVILIAN COMPLAINT REVIEW BD,Experienced (non-manager),60213,89822
Office Manager- Bureau of Early Intervention,DEPT OF HEALTH/MENTAL HYGIENE,Experienced (non-manager),58695,70000
Executive Director of Budget,DEPT OF CITYWIDE ADMIN SVCS,Manager,110000,125000
DEPUTY AGENCY CHIEF CONTRACTING OFFICER,DEPT OF ENVIRONMENT PROTECTION,Manager,58700,145000
Goods & Services Procurement Section Unit Lead,DEPT OF ENVIRONMENT PROTECTION,Experienced (non-manager),60010,100875
Director of Planning & Procurement,DEPT OF ENVIRONMENT PROTECTION,Executive,80931,208826
Managerial Lump Sum Associate- Silver Stars Program,OFFICE OF THE COMPTROLLER,Experienced (non-manager),30,30
Forensic Photographer (per diem),DEPT OF HEALTH/MENTAL HYGIENE,Experienced (non-manager),24.3547,27.5205
Data Analyst,DEPARTMENT FOR THE AGING,Experienced (non-manager),81951,94244
Chief Information Officer,DEPARTMENT OF PROBATION,Experienced (non-manager),75000,160000
RAR CLIENT ADVOCATE,HRA/DEPT OF SOCIAL SERVICES,Experienced (non-manager),53057,61015
SCADA Support Specialist,DEPT OF ENVIRONMENT PROTECTION,Experienced (non-manager),85371,109990
Executive Office Intern,TECHNOLOGY & INNOVATION,Student,15.5,19.9
STRATEGIC INITIATIVES MANAGER,HRA/DEPT OF SOCIAL SERVICES,Experienced (non-manager),54100,83981
Contract Analyst,FIRE DEPARTMENT,Experienced (non-manager),35.7044,83.0925
Forensic Science Unit: Cold Case Assistant District Attorney,BRONX DISTRICT ATTORNEY,Experienced (non-manager),80440,167610
Prevention Outreach Specialist-  Bureau of Equitable Health Systems,DEPT OF HEALTH/MENTAL HYGIENE,Experienced (non-manager),59116,60000
PEOPLESOFT DEVELOPER,FINANCIAL INFO SVCS AGENCY,Experienced (non-manager),110000,120000
Team Lead- Bureau of Hepatitis- HIV- and STI,DEPT OF HEALTH/MENTAL HYGIENE,Manager,70611,81203
BUYER,DEPT OF ENVIRONMENT PROTECTION,Experienced (non-manager),60010,100875
Exterminator- Bureau of Veterinary and Pest Control Services,DEPT OF HEALTH/MENTAL HYGIENE,Experienced (non-manager),34027,41438
Editorial Assistant,DEPT OF CITYWIDE ADMIN SVCS,Entry-Level,58695,67499
DEPUTY DIRECTOR- FHEP CENTRALIZED DETERMINATION UNIT (FDCU),HRA/DEPT OF SOCIAL SERVICES,Experienced (non-manager),73029,107348
Director of Bridges Performance Management,DEPARTMENT OF TRANSPORTATION,Experienced (non-manager),74710,100812
Director of Procurement- Executive Administration,DEPT OF ENVIRONMENT PROTECTION,Experienced (non-manager),65232,130000
Senior IT Architect,DEPARTMENT OF TRANSPORTATION,Experienced (non-manager),0,140000
TEMP CONTRACT PROCUREMENT ANALYST,HRA/DEPT OF SOCIAL SERVICES,Experienced (non-manager),50972,58618
DATA SECURITY SPECIALIST,HRA/DEPT OF SOCIAL SERVICES,Experienced (non-manager),85371,98177
Senior Counsel,DEPARTMENT OF TRANSPORTATION,Manager,58700,161534
Communications Unit College Aide,OFF OF PAYROLL ADMINISTRATION,Student,15.5,19.9
PROJECT DIRECTOR/TECHNICAL TEAM LEAD,HRA/DEPT OF SOCIAL SERVICES,Experienced (non-manager),98901,136951
EXECUTIVE DIRECTOR- HRA TECHNOLOGY/ELIGIBILITY SYSTEMS,HRA/DEPT OF SOCIAL SERVICES,Manager,77688,152000
Program Analyst,NYC HOUSING AUTHORITY,Experienced (non-manager),70341,102282
Senior Data Analytics and Reporting Data Engineer- Digital Platform Solutions,MAYORS OFFICE OF CONTRACT SVCS,Manager,85000,110000
Director of Strategic  Initiatives,DEPT. OF HOMELESS SERVICES,Experienced (non-manager),64749,134280
CASE MANAGEMENT SUPERVISOR,HRA/DEPT OF SOCIAL SERVICES,Experienced (non-manager),51869,82086
Supervising Attorney – Settlements,TAXI & LIMOUSINE COMMISSION,Experienced (non-manager),71423,82137
Solution Architect CAD,FIRE DEPARTMENT,Experienced (non-manager),75000,140000
Early Childhood Education Consultant- Bureau of Childcare,DEPT OF HEALTH/MENTAL HYGIENE,Experienced (non-manager),66442,72000
Management Auditor- Level II (CIVILIANIZATION),POLICE DEPARTMENT,Experienced (non-manager),64857,98100
ASSISTANT DIRECTOR- BOROUGH INITIATIVES AND RESIDENT PROGRAMS,NYC HOUSING AUTHORITY,Experienced (non-manager),64749,134280
Junior Summer Camp Counselor,DEPT OF PARKS & RECREATION,Entry-Level,15.45,15.45
Junior Summer Camp Counselor,DEPT OF PARKS & RECREATION,Entry-Level,15.45,15.45
Deputy Equal Employment Opportunity (EEO) Officer,BRONX DISTRICT ATTORNEY,Manager,125000,135000
Project Manager Intern,DEPT OF ENVIRONMENT PROTECTION,Entry-Level,51535,59265
Developer (Web Applications),DEPT OF DESIGN & CONSTRUCTION,Experienced (non-manager),100000,113736
Senior Project Controls Specialist,DEPT OF DESIGN & CONSTRUCTION,Experienced (non-manager),75000,128750
PLANNING AND DEVELOPMENT ASSOCIATE PLANNER,BOROUGH PRESIDENT-BRONX,Experienced (non-manager),59116,91768
Staff Analyst,LAW DEPARTMENT,Experienced (non-manager),62470,80008
WTC Case Management Nurse,FIRE DEPARTMENT,Experienced (non-manager),84744,84744
Communications Director,DEPARTMENT FOR THE AGING,Manager,110000,114000
Crime Victim Advocate: Violence Response Specialist,BRONX DISTRICT ATTORNEY,Experienced (non-manager),62215,62215
Associate Project Manager,DEPT OF ENVIRONMENT PROTECTION,Manager,67757,98128
Industrial/Commercial Program Section Lead,DEPT OF ENVIRONMENT PROTECTION,Experienced (non-manager),74650,109409
Senior Police Administrative Aide,POLICE DEPARTMENT,Experienced (non-manager),43929,57093
ASSISTANT COMMISSIONER-HOUSING & PUBLIC ACCOMMODATIONS,HUMAN RIGHTS COMMISSION,Manager,125000,125000
Climber & Pruner,DEPT OF ENVIRONMENT PROTECTION,Entry-Level,59204,73301
Applications Developer,DEPT OF ENVIRONMENT PROTECTION,Experienced (non-manager),76584,112111
Clerical Support for the Emergency Operations Division,HOUSING PRESERVATION & DVLPMNT,Entry-Level,38333,44083
Stationary Engineer,DEPT OF CITYWIDE ADMIN SVCS,Experienced (non-manager),508.8,508.8
Civil Engineer Intern,DEPARTMENT OF TRANSPORTATION,Experienced (non-manager),51413,62260
AGENCY ATTORNEY I,HUMAN RIGHTS COMMISSION,Experienced (non-manager),63228,72712
TECHNICAL SUPPORT ASSOCIATE,HRA/DEPT OF SOCIAL SERVICES,Experienced (non-manager),73507,84533
ENROLLMENT SPECIALIST,HRA/DEPT OF SOCIAL SERVICES,Experienced (non-manager),38333,47634
ACCOUNTABLE MANAGER,DEPT OF ENVIRONMENT PROTECTION,Experienced (non-manager),74650,109409
Outreach Specialist (per diem),DEPT OF HEALTH/MENTAL HYGIENE,Experienced (non-manager),31.0192,39.092
SMOKE-FREE NYCHA COORDINATOR,NYC HOUSING AUTHORITY,Experienced (non-manager),54100,83981
Capital Projects/On-Call Design Manager,DEPT OF ENVIRONMENT PROTECTION,Experienced (non-manager),80000,105000
Summer Intern,DEPARTMENT OF TRANSPORTATION,Student,15,17.5
Summer Sports Experience Coach,DEPT OF PARKS & RECREATION,Experienced (non-manager),28.2091,28.2091
SUMMER COLLEGE INTERN  Social Services,OFFICE OF MANAGEMENT & BUDGET,Student,16.5,16.5
Analyst  POLICY AND OPERATIONS RESEARCH,OFFICE OF MANAGEMENT & BUDGET,Entry-Level,51550,73806
Project Coordinator,DEPARTMENT OF CORRECTION,Experienced (non-manager),65731,75591
Design Engineer,DEPT OF DESIGN & CONSTRUCTION,Experienced (non-manager),57078,65640
Senior Planning Analyst,BRONX DISTRICT ATTORNEY,Experienced (non-manager),94000,94000
Childcare Investigator,DEPT OF HEALTH/MENTAL HYGIENE,Experienced (non-manager),51079,76332
Executive Assistant to Corporate Secretary,NYC HOUSING AUTHORITY,Experienced (non-manager),76294,108156
Division Chief of Engineering,DEPT OF ENVIRONMENT PROTECTION,Manager,72038,192152
Stationary Engineer (Electric),DEPT OF ENVIRONMENT PROTECTION,Experienced (non-manager),62.74,62.74
CLAIM SPECIALIST,LAW DEPARTMENT,Experienced (non-manager),41483,47705
CLAIM SPECIALIST,LAW DEPARTMENT,Experienced (non-manager),41483,47705
Staff Analyst,DEPARTMENT OF TRANSPORTATION,Experienced (non-manager),62470,80008
Bounty Processing Unit Clerk,ADMIN TRIALS AND HEARINGS,Experienced (non-manager),54100,67983
ASSISTANT HOUSING MANAGER,NYC HOUSING AUTHORITY,Entry-Level,49609,77454
Senior Supervising Attorney – Adjudications and ARTS,TAXI & LIMOUSINE COMMISSION,Experienced (non-manager),79620,91563
Clerical Associate (Part-Time)- Settlements and Adjudications Unit,OFFICE OF THE COMPTROLLER,Experienced (non-manager),18,18
Principal Administrative Associate III / Executive Assistant- Bureau of Early Intervention,DEPT OF HEALTH/MENTAL HYGIENE,Experienced (non-manager),58695,67499
Supervisor of the Wards Island Priority Pollutants Laboratory,DEPT OF ENVIRONMENT PROTECTION,Experienced (non-manager),78128,118657
Director of Intergovernmental & Legislative Affairs,OFFICE OF THE COMPTROLLER,Manager,90000,95000
Deputy Commissioner- Public Information,FIRE DEPARTMENT,Executive,106729,213210
HOUSING ASSISTANT,NYC HOUSING AUTHORITY,Experienced (non-manager),39098,63367
Deputy Medical Director,FIRE DEPARTMENT,Manager,97830,199650
FAIR FARES AGENT,HRA/DEPT OF SOCIAL SERVICES,Experienced (non-manager),37748,57043
Institutional Aide (per diem),DEPT OF HEALTH/MENTAL HYGIENE,Experienced (non-manager),16.5766,19.0632
Stormwater Resiliency Design Manager,DEPT OF ENVIRONMENT PROTECTION,Experienced (non-manager),74650,109409
Electrician,DEPT OF ENVIRONMENT PROTECTION,Experienced (non-manager),440.16,440.16
Procedural Justice Coordinator,ADMIN TRIALS AND HEARINGS,Experienced (non-manager),59116,67983
Enrollment Specialist,HRA/DEPT OF SOCIAL SERVICES,Experienced (non-manager),47634,47634
Web Developer,OFFICE OF THE COMPTROLLER,Experienced (non-manager),81951,100000
Program Supervisor,DEPT OF YOUTH & COMM DEV SRVS,Entry-Level,15.45,17.65
Team Leader,DEPARTMENT OF TRANSPORTATION,Experienced (non-manager),90114,122168
Testifier / Searcher (Hourly),DEPARTMENT OF TRANSPORTATION,Experienced (non-manager),21.9031,34.3842
Steam Fitter,DEPT OF CITYWIDE ADMIN SVCS,Experienced (non-manager),430.5,430.5
Curriculum Development Specialist,TAXI & LIMOUSINE COMMISSION,Experienced (non-manager),62470,80008
Administrative Assistant,DEPARTMENT OF INVESTIGATION,Experienced (non-manager),40017,53712
Region Supervisor,DEPT OF ENVIRONMENT PROTECTION,Experienced (non-manager),53702,148745
SILVER STAR PROCUREMENT ANALYST,FINANCIAL INFO SVCS AGENCY,Experienced (non-manager),35,40
HIGH PRESSURE PLANT TENDER,DEPT OF CITYWIDE ADMIN SVCS,Experienced (non-manager),300.8,300.8
EHV Owner Services Specialist for the Division of Tenant Resources,HOUSING PRESERVATION & DVLPMNT,Experienced (non-manager),40667,46767
Cook,ADMIN FOR CHILDREN'S SVCS,Entry-Level,36627,52580
EMPLOYEE ASSISTANCE PROGRAM SPECIALIST,FIRE DEPARTMENT,Experienced (non-manager),54878,98537
Network Security Engineer,DEPT OF HEALTH/MENTAL HYGIENE,Experienced (non-manager),78795,113300
